id,question,answer
317,What is the purpose of the term imputation in handling missing data in machine learning?,"Imputation is the process of filling in missing values in a dataset with estimated or predicted values. It is crucial for handling missing data in machine learning, as many algorithms require complete datasets for training and prediction. Common imputation methods include mean imputation, median imputation, and regression-based imputation, each addressing missing data challenges in different ways."
318,Explain the concept of the term natural language generation (NLG) in artificial intelligence.,"Natural Language Generation (NLG) in artificial intelligence involves the automatic creation of human-readable text from structured data. It transforms data into coherent and contextually relevant narratives, making it valuable for applications such as chatbots, report generation, and content creation. NLG systems use algorithms and language models to generate text that mimics human language."
319,Define the terms precision at k (P@k) and its significance in information retrieval.,"Precision at k (P@k) is a metric used in information retrieval to evaluate the accuracy of top-k retrieved documents. It measures the proportion of relevant documents among the top k retrieved documents. P@k is crucial in assessing the effectiveness of retrieval systems, especially when users are interested in a specific number of top-ranked and relevant documents."
320,What is the role of the term recurrent neural network (RNN) in time series forecasting?,"Recurrent Neural Network (RNN) is used in time series forecasting to capture temporal dependencies and sequential patterns in data. It maintains a hidden state that retains information from previous time steps, allowing the model to consider context when making predictions. RNNs are effective in tasks where the order of data points is essential, such as predicting stock prices or weather conditions."
321,Explain the concept of the term word frequency-inverse document frequency (TF-IDF) in natural language processing.,"Term Frequency-Inverse Document Frequency (TF-IDF) is a numerical statistic that reflects the importance of a word in a document relative to a collection of documents. It is commonly used in natural language processing for text analysis and information retrieval. TF-IDF considers both the frequency of a term in a document (TF) and its rarity across documents (IDF), assigning higher weights to terms that are more discriminative."
322,Define the terms precision and recall in the context of binary classification.,"In binary classification, precision measures the accuracy of positive predictions, representing the ratio of true positive predictions to the total predicted positives. Recall measures the ability to capture all instances of the positive class, indicating the ratio of true positive predictions to the total actual positives. Precision and recall provide insights into different aspects of model performance, and finding the right balance is crucial."
323,What is the purpose of the term unsupervised learning in machine learning?,"Unsupervised learning in machine learning involves training models on unlabeled data to discover patterns, structures, and relationships within the data. Unlike supervised learning, there are no predefined target labels, and the algorithm explores the inherent structure of the input data. Unsupervised learning is used for clustering, dimensionality reduction, and generative tasks, providing insights into the underlying characteristics of datasets."
324,Explain the concept of the term Gaussian Naive Bayes classifier in machine learning.,"Gaussian Naive Bayes is a probabilistic classification algorithm based on Bayes' theorem. It assumes that features follow a Gaussian (normal) distribution within each class. Despite its 'naive' assumption of feature independence, Gaussian Naive Bayes is effective in various applications, especially when dealing with continuous data. It is commonly used in spam filtering, sentiment analysis, and other classification tasks."
325,Define the terms overfitting and underfitting in machine learning models.,"Overfitting occurs when a model learns the training data too well, capturing noise and outliers, but performs poorly on new, unseen data. Underfitting happens when a model is too simple and cannot capture the underlying patterns in the training data. Balancing between overfitting and underfitting is crucial for developing models that generalize well to diverse datasets."
326,What is the role of the term principal component analysis (PCA) in dimensionality reduction?,"Principal Component Analysis (PCA) is a technique used for dimensionality reduction in machine learning. It transforms high-dimensional data into a lower-dimensional representation by identifying orthogonal axes (principal components) that capture the maximum variance. PCA is valuable for reducing the curse of dimensionality, improving computational efficiency, and visualizing complex datasets in a lower-dimensional space."
327,Explain the concept of the term hyperparameter tuning in machine learning models.,"Hyperparameter tuning involves systematically searching for the best hyperparameter values to optimize a machine learning model's performance. It is essential for finding the right balance between model complexity and generalization. Techniques like grid search and random search are commonly used for hyperparameter tuning, contributing to enhanced model effectiveness in various tasks."
328,Define the terms batch normalization and its significance in training deep neural networks.,"Batch normalization is a technique in deep learning that normalizes the input of each layer to have zero mean and unit variance. It helps mitigate issues like internal covariate shift during training, making deep neural networks more stable and converge faster. Batch normalization is applied to mini-batches of data, and it contributes to improved generalization and training efficiency."
329,What is the purpose of the term confusion matrix in evaluating classification models?,"A confusion matrix is a table that summarizes the performance of a classification model by displaying the counts of true positive, true negative, false positive, and false negative predictions. It provides insights into the model's accuracy, precision, recall, and other performance metrics. A confusion matrix is a valuable tool for assessing the overall effectiveness and limitations of a classification algorithm."
330,Explain the concept of the term natural language processing (NLP) and its applications.,"Natural Language Processing (NLP) is a subfield of artificial intelligence focused on enabling computers to understand, interpret, and generate human language. NLP applications include machine translation, sentiment analysis, chatbots, speech recognition, and text summarization. NLP techniques involve linguistic analysis, statistical modeling, and machine learning to extract meaningful information from textual data."
331,Define the terms precision and recall in the context of multi-class classification.,"In multi-class classification, precision measures the accuracy of positive predictions for a specific class, representing the ratio of true positive predictions to the total predicted positives for that class. Recall measures the ability to capture all instances of a specific class, indicating the ratio of true positive predictions to the total actual positives for that class."
332,What is the role of the term K-means clustering in unsupervised machine learning?,"K-means clustering is an unsupervised machine learning algorithm used for partitioning data points into k clusters based on similarity. It minimizes the sum of squared distances between data points and the centroid of their assigned cluster. K-means is widely used for clustering tasks, such as customer segmentation and image compression, and it requires specifying the number of clusters (k) in advance."
333,Explain the concept of the term precision-recall curve and its significance in evaluating classification models.,"The precision-recall curve is a graphical representation of the trade-off between precision and recall at various classification thresholds. It is particularly useful for assessing model performance on imbalanced datasets, where precision and recall are critical. The area under the precision-recall curve (AUC-PR) provides a summarized metric for overall model evaluation."
334,Define the terms hyperparameter and its role in machine learning model configuration.,"A hyperparameter is a configuration setting external to a machine learning model that cannot be learned from the data but must be specified before training. Examples include learning rates, regularization strengths, and model architectures. Tuning hyperparameters is crucial for optimizing model performance, achieving better generalization, and adapting the model to different datasets and tasks."
335,What is the purpose of the term softmax activation function in neural networks?,"Softmax activation function is commonly used in the output layer of neural networks for multi-class classification tasks. It converts raw scores (logits) into probabilities, assigning a probability distribution over multiple classes. Softmax ensures that the predicted probabilities sum to 1, making it suitable for determining the most likely class in a multi-class setting."
336,Explain the concept of the term ensemble learning in machine learning.,"Ensemble learning involves combining predictions from multiple models to improve overall performance. Techniques like bagging and boosting create diverse models, reducing overfitting and enhancing generalization. Ensemble learning is effective in improving accuracy, robustness, and stability, making it a valuable approach across various machine learning tasks, including classification and regression."
337,Define the terms false discovery rate (FDR) and false omission rate (FOR) in binary classification.,False Discovery Rate (FDR) measures the proportion of false positive predictions among all predicted positives in binary classification. False Omission Rate (FOR) measures the proportion of false negative predictions among all predicted negatives. Both FDR and FOR provide insights into different aspects of model performance and are relevant in applications where the cost of errors varies.
338,What is the role of the term batch size in training neural networks?,"Batch size in neural networks represents the number of training samples utilized in one iteration. It affects the model's learning dynamics and training efficiency. Small batch sizes introduce more noise but can lead to faster convergence, while large batch sizes provide more accurate gradients but require more memory. The choice of batch size depends on factors like available memory, computational resources, and the dataset's characteristics."
339,Explain the concept of the term reinforcement learning in machine learning.,"Reinforcement learning is a machine learning paradigm where an agent learns to make decisions by interacting with an environment. The agent receives feedback in the form of rewards or penalties based on its actions, guiding it to discover optimal strategies. Reinforcement learning is used in various applications, including game playing, robotics, and autonomous systems, where agents learn to make sequential decisions to maximize cumulative rewards."
340,Define the terms precision at k (P@k) and its significance in recommendation systems.,"Precision at k (P@k) is a metric used in recommendation systems to evaluate the accuracy of top-k recommendations. It measures the proportion of relevant items among the top k recommended items. P@k is crucial in assessing the system's effectiveness, especially when users are interested in a specific number of top-ranked recommendations rather than the entire list."
341,What is the purpose of the term word embedding in natural language processing?,"Word embedding is a technique in natural language processing that represents words as dense vectors in a continuous vector space. It captures semantic relationships between words, allowing machine learning models to understand context and meaning. Word embeddings, such as Word2Vec and GloVe, are widely used in tasks like sentiment analysis, machine translation, and document clustering."
342,Explain the concept of the term dropout in neural networks.,"Dropout is a regularization technique in neural networks where randomly selected neurons are ignored during training. It helps prevent overfitting by introducing noise and redundancy, making the network more robust. During each training iteration, a fraction of neurons is 'dropped out,' forcing the network to rely on different pathways for learning. Dropout is effective in improving generalization and model performance."
343,Define the terms precision and recall in the context of object detection.,"In object detection, precision measures the accuracy of positive predictions for identified objects, representing the ratio of true positive detections to the total predicted detections. Recall measures the ability to capture all instances of objects, indicating the ratio of true positive detections to the total actual objects present. Balancing precision and recall is crucial for effective object detection models."
344,What is the role of the term attention mechanism in neural networks?,"Attention mechanisms in neural networks enable models to focus on specific parts of input sequences when making predictions. They assign different weights to different elements of the input, allowing the model to emphasize relevant information. Attention is particularly useful in tasks like machine translation, where the network can selectively attend to parts of the source sentence while generating the corresponding translated words."
345,Explain the concept of the term transfer learning in natural language processing.,"Transfer learning in natural language processing involves leveraging knowledge gained from pre-trained language models to improve performance on specific tasks. Pre-trained models, such as BERT and GPT, capture general language understanding and can be fine-tuned for specific applications like sentiment analysis or named entity recognition. Transfer learning accelerates training and enhances model performance, especially with limited task-specific labeled data."
346,Define the terms precision and recall in the context of information retrieval.,"In information retrieval, precision measures the accuracy of positive predictions, representing the ratio of relevant documents retrieved to the total retrieved documents. Recall measures the ability to capture all relevant documents, indicating the ratio of relevant documents retrieved to the total actual relevant documents. Precision and recall are crucial for evaluating the effectiveness of retrieval systems."
347,What is the purpose of the term natural language understanding (NLU) in chatbot development?,"Natural Language Understanding (NLU) in chatbot development involves the ability of chatbots to comprehend and interpret user input in natural language. It goes beyond simple language processing and aims to extract meaning, context, and intent from user messages. NLU is essential for developing chatbots that can provide relevant and contextually appropriate responses, enhancing the user experience."
348,Explain the concept of the term precision-recall curve and its significance in evaluating information retrieval systems.,"The precision-recall curve is a graphical representation of the trade-off between precision and recall at various retrieval thresholds. It is particularly useful for evaluating information retrieval systems, especially in scenarios with imbalanced datasets. The area under the precision-recall curve (AUC-PR) provides a summarized metric for overall system evaluation, considering both precision and recall performance."
349,Define the terms bias and variance in the context of machine learning models.,"Bias refers to the error introduced by approximating a real-world problem with a simplified model. High bias may lead to underfitting, where the model fails to capture the underlying patterns in the data. Variance measures the model's sensitivity to fluctuations in the training data. High variance may result in overfitting, where the model performs well on training data but poorly on new, unseen data. Balancing bias and variance is crucial for achieving optimal model performance."
350,What is the role of the term recurrent neural network (RNN) in sequence-to-sequence tasks?,"Recurrent Neural Network (RNN) is used in sequence-to-sequence tasks, such as language translation, where input and output sequences have variable lengths. RNNs maintain hidden states that capture information from previous time steps, enabling the model to consider context when generating sequences. Long Short-Term Memory (LSTM) and Gated Recurrent Unit (GRU) are variants of RNNs commonly used for addressing the vanishing gradient problem in longer sequences."
351,Explain the concept of the term precision at k (P@k) and its significance in recommendation systems.,"Precision at k (P@k) is a metric used in recommendation systems to evaluate the accuracy of top-k recommendations. It measures the proportion of relevant items among the top k recommended items. P@k is crucial in assessing the system's effectiveness, especially when users are interested in a specific number of top-ranked recommendations rather than the entire list."
352,Define the terms hyperparameter tuning and its significance in optimizing machine learning models.,"Hyperparameter tuning involves adjusting external configuration settings (hyperparameters) of machine learning models to achieve optimal performance. It is crucial for finding the right balance between model complexity and generalization. Techniques like grid search and random search are commonly used for hyperparameter tuning, contributing to enhanced model convergence, generalization, and overall effectiveness in various machine learning tasks."
353,What is the purpose of the term precision-recall curve in evaluating binary classification models?,"The precision-recall curve is a graphical representation of the trade-off between precision and recall at various classification thresholds. It is particularly useful for assessing model performance on imbalanced datasets, where precision and recall are critical. The area under the precision-recall curve (AUC-PR) provides a summarized metric for overall model evaluation in binary classification."
354,Explain the concept of the term bagging and its significance in ensemble learning.,"Bagging (Bootstrap Aggregating) is an ensemble learning technique that involves training multiple models independently on different subsets of the training data and aggregating their predictions. It helps reduce overfitting and variance, leading to improved generalization and robustness. Bagging is applied in various algorithms, with Random Forest being a notable example of a bagging-based ensemble method."
355,Define the terms decision tree and its use in machine learning models.,"A decision tree is a tree-like model that makes decisions based on the features of input data. It recursively splits the data into subsets based on the most significant feature, leading to a tree structure with decision nodes and leaf nodes. Decision trees are used in classification and regression tasks, providing interpretable and easy-to-understand models. Ensemble methods like Random Forest combine multiple decision trees for improved accuracy."
356,What is the role of the term unsupervised learning in clustering similar items in a dataset?,"Unsupervised learning in clustering involves identifying similar items or patterns in a dataset without labeled target information. Clustering algorithms, such as K-means and hierarchical clustering, group data points based on similarities in features. Unsupervised learning is valuable for exploring the inherent structure of data, discovering hidden patterns, and organizing items into meaningful clusters."
357,Explain the concept of the term kernel in support vector machines (SVM).,"In support vector machines (SVM), a kernel is a function that transforms the input data into a higher-dimensional space, making it easier to find a hyperplane that separates different classes. Common kernel functions include linear, polynomial, and radial basis function (RBF). Kernels enable SVMs to handle complex relationships in the data, allowing for effective classification in both linear and non-linear scenarios."
358,Define the terms precision and recall in the context of text classification.,"In text classification, precision measures the accuracy of positive predictions for a specific class, representing the ratio of true positive predictions to the total predicted positives for that class. Recall measures the ability to capture all instances of a specific class, indicating the ratio of true positive predictions to the total actual positives for that class. Balancing precision and recall is crucial for effective text classification models."
359,What is the purpose of the term reinforcement learning in training autonomous agents?,"Reinforcement learning is used in training autonomous agents to make sequential decisions by interacting with an environment. The agent receives feedback in the form of rewards or penalties based on its actions, guiding it to discover optimal strategies. Reinforcement learning is applied in robotics, game playing, and autonomous systems, enabling agents to learn and adapt to dynamic environments."
360,Explain the concept of the term perplexity in language modeling.,"Perplexity is a measure of how well a language model predicts a given sequence of words. It quantifies the uncertainty or surprise associated with predicting the next word in a sequence. Lower perplexity indicates better model performance, as the model is more certain about its predictions. Perplexity is commonly used in evaluating the effectiveness of language models, especially in tasks like machine translation and text generation."
361,Define the terms precision and recall in the context of anomaly detection.,"In anomaly detection, precision measures the accuracy of positive predictions for identifying anomalies, representing the ratio of true positive predictions to the total predicted anomalies. Recall measures the ability to capture all instances of anomalies, indicating the ratio of true positive predictions to the total actual anomalies. Precision and recall are crucial for assessing the effectiveness of anomaly detection models."
362,What is the role of the term L1 regularization in machine learning models?,"L1 regularization adds the absolute values of the coefficients to the loss function during model training. It penalizes large coefficients, encouraging sparsity in the model. L1 regularization is effective in feature selection, as it tends to drive some coefficients to exactly zero. It is a technique to prevent overfitting and enhance the interpretability of machine learning models."
363,Explain the concept of the term cosine similarity and its application in measuring similarity between vectors.,"Cosine similarity is a metric used to measure the cosine of the angle between two non-zero vectors. It quantifies the similarity between vectors irrespective of their magnitudes and is commonly used in information retrieval, text mining, and recommendation systems. Cosine similarity ranges from -1 (opposite directions) to 1 (same direction), with 0 indicating orthogonality."
364,Define the terms activation function and its significance in neural networks.,"An activation function in neural networks introduces non-linearity, enabling the model to learn complex patterns and relationships in the data. Common activation functions include sigmoid, tanh, and rectified linear unit (ReLU). Activation functions allow neural networks to approximate and represent non-linear mappings, enhancing the model's capacity to learn intricate features."
365,What is the purpose of the term gradient descent in training machine learning models?,"Gradient descent is an optimization algorithm used to minimize the loss function and find the optimal parameters during the training of machine learning models. It iteratively adjusts the model parameters in the direction of the steepest decrease in the loss function. Gradient descent is fundamental to training neural networks and other machine learning models, contributing to convergence and improved performance."
366,Explain the concept of the term hyperparameter tuning in optimizing machine learning models.,"Hyperparameter tuning involves adjusting the external configuration settings (hyperparameters) of machine learning models to achieve optimal performance. Common hyperparameters include learning rates, regularization strengths, and model architectures. Tuning these parameters is crucial for improving model convergence, generalization, and overall effectiveness in various machine learning tasks."
367,Define the terms bagging and its significance in ensemble learning.,"Bagging (Bootstrap Aggregating) is an ensemble learning technique that involves training multiple models independently on different subsets of the training data and aggregating their predictions. It helps reduce overfitting and variance, leading to improved generalization and robustness. Bagging is applied in various algorithms, with Random Forest being a notable example of a bagging-based ensemble method."
