id,question,answer
151,Define the terms precision and recall in the context of multi-label classification.,"In multi-label classification, precision measures the accuracy of positive predictions for a specific class, representing the ratio of true positive predictions to the total predicted positives for that class. Recall measures the ability to capture all instances of a specific class, indicating the ratio of true positive predictions to the total actual positives for that class."
152,What is the purpose of the term cross-entropy loss in classification models?,"Cross-entropy loss, also known as log loss, is a loss function used in classification models. It measures the difference between the predicted probability distribution and the true distribution of the target variable. Minimizing cross-entropy loss during training helps the model generate more accurate and calibrated probability predictions."
153,Explain the concept of the term mean squared error (MSE) in regression models.,Mean Squared Error (MSE) is a common loss function used in regression models. It calculates the average squared difference between predicted and actual values. Minimizing MSE during training leads to a regression model that provides accurate predictions by penalizing large errors more severely than small errors.
154,What is the role of the term feature importance in decision tree models?,Feature importance in decision tree models indicates the contribution of each feature to the model's predictive accuracy. It is determined by evaluating how much each feature decreases the impurity or error in the data when used for splitting. Feature importance helps identify the most influential features in decision-making.
155,Define the terms positive predictive value (PPV) and negative predictive value (NPV) in medical diagnostic models.,"Positive Predictive Value (PPV) measures the probability that a positive prediction from a diagnostic model is correct, indicating the ratio of true positive predictions to the total predicted positives. Negative Predictive Value (NPV) measures the probability that a negative prediction is correct, indicating the ratio of true negative predictions to the total predicted negatives."
156,What is the purpose of the term feature scaling in machine learning?,"Feature scaling ensures that input features have similar scales or ranges, preventing certain features from dominating the learning process. Common techniques include Min-Max scaling and Z-score normalization. Feature scaling is crucial for algorithms sensitive to feature scales, such as gradient-based optimization methods in machine learning."
157,How does the concept of the term perplexity contribute to evaluating language models?,"Perplexity is a metric used to evaluate the performance of language models. It measures how well a language model predicts a given dataset. Lower perplexity values indicate better model performance, as the model is more certain about its predictions. Perplexity is commonly used in natural language processing tasks like machine translation and text generation."
158,What is the role of the term feature extraction in machine learning?,"Feature extraction involves transforming raw data into a format that is more suitable for machine learning models. It aims to highlight relevant information, reduce dimensionality, and improve the efficiency of model training. Feature extraction techniques include Principal Component Analysis (PCA), t-Distributed Stochastic Neighbor Embedding (t-SNE), and various signal processing methods."
159,Define the terms false discovery rate (FDR) and false omission rate (FOR) in binary classification.,False Discovery Rate (FDR) measures the proportion of false positive predictions among all predicted positives in binary classification. False Omission Rate (FOR) measures the proportion of false negative predictions among all predicted negatives. Both metrics provide insights into different aspects of model performance and are used in applications where the cost of errors varies.
160,What is the purpose of the term feature importance in ensemble learning models like gradient boosting?,Feature importance in ensemble learning models like gradient boosting indicates the contribution of each feature to the model's overall predictive performance. It is determined by assessing how much each feature improves the model's ability to make accurate predictions. Feature importance guides practitioners in understanding and selecting relevant features for model interpretation and optimization.
161,What is the purpose of the term cosine similarity in natural language processing?,"Cosine similarity is a metric used to measure the similarity between two vectors by calculating the cosine of the angle between them. In natural language processing, it is often employed to assess the similarity between documents or text passages, enabling tasks like document clustering and information retrieval."
162,Explain the concept of the term fine-tuning in transfer learning for image classification.,"Fine-tuning in transfer learning for image classification involves taking a pre-trained convolutional neural network (CNN) and adjusting its parameters on a new dataset. By leveraging knowledge from the original task, fine-tuning helps the model adapt to the specific features and patterns of the new image classification task."
163,What is the role of the term hyperparameter tuning in optimizing machine learning models?,Hyperparameter tuning involves systematically searching for the best hyperparameter values to optimize a machine learning model's performance. It is essential for finding the right balance between model complexity and generalization. Techniques like grid search and random search are commonly used for hyperparameter tuning.
164,Define the terms latent semantic analysis (LSA) and its application in document clustering.,"Latent Semantic Analysis (LSA) is a technique in natural language processing that analyzes relationships between terms and documents. It applies singular value decomposition to represent documents and terms in a lower-dimensional space. In document clustering, LSA helps identify latent semantic structures, improving the grouping of related documents."
165,What is the purpose of the term word embeddings in machine learning models?,"Word embeddings are dense vector representations of words in a continuous vector space. They capture semantic relationships between words, enabling machine learning models to understand context and meaning. Word embeddings are widely used in natural language processing tasks, such as sentiment analysis, machine translation, and named entity recognition."
166,Explain the concept of the term transfer learning in computer vision.,"Transfer learning in computer vision involves using pre-trained models on large image datasets for new tasks. Instead of training a model from scratch, knowledge gained from a source task is transferred to a target task. Transfer learning accelerates model training, especially when limited labeled data is available for the target task."
167,Define the terms precision at k (P@k) and its significance in information retrieval.,"Precision at k (P@k) is a metric in information retrieval that measures the accuracy of a system by evaluating the proportion of relevant documents among the top k retrieved documents. P@k is significant in assessing the effectiveness of a retrieval system, particularly when users are interested in a specific number of top results."
168,What is the role of the term perplexity in evaluating language models?,Perplexity is a metric used to evaluate the performance of language models in predicting a sequence of words. Lower perplexity values indicate that the model is more certain about its predictions and has a better understanding of the given language data. Perplexity is commonly used in tasks like language modeling and machine translation.
169,How does the concept of the term activation function contribute to the non-linearity in neural networks?,"Activation functions introduce non-linearity in neural networks, allowing them to learn complex patterns and relationships in data. Common activation functions include sigmoid, tanh, and rectified linear unit (ReLU). Activation functions enable neural networks to approximate and represent non-linear mappings, improving their ability to solve complex problems."
170,What is the purpose of the term dropout in recurrent neural networks (RNNs)?,Dropout in recurrent neural networks involves randomly deactivating a fraction of neurons during training. It helps prevent overfitting by introducing noise and promoting the learning of more robust features. Dropout is particularly beneficial in RNNs to address challenges like vanishing gradients and improve the generalization of the model.
171,Explain the concept of the term expectation-maximization (EM) algorithm in unsupervised learning.,The Expectation-Maximization (EM) algorithm is used in unsupervised learning to estimate parameters of probabilistic models with latent variables. It iteratively performs an E-step to estimate the expected values of latent variables and an M-step to maximize the likelihood of observed data given the estimated values. EM is widely used in clustering and Gaussian mixture models.
172,Define the terms Bagging and Boosting in ensemble learning.,"Bagging (Bootstrap Aggregating) and Boosting are ensemble learning techniques. Bagging involves training multiple models independently on different subsets of the training data and averaging their predictions. Boosting, on the other hand, focuses on training weak models sequentially, giving more weight to misclassified instances in each iteration to improve overall performance."
173,What is the role of the term cosine similarity in collaborative filtering for recommendation systems?,"Cosine similarity is commonly used in collaborative filtering for recommendation systems. It measures the cosine of the angle between user-item vectors, indicating the similarity between user preferences and item characteristics. Higher cosine similarity values suggest greater similarity, aiding in the recommendation of items that align with a user's preferences."
174,Define the terms precision and recall in the context of multi-class classification.,"In multi-class classification, precision measures the accuracy of positive predictions for a specific class, representing the ratio of true positive predictions to the total predicted positives for that class. Recall measures the ability to capture all instances of a specific class, indicating the ratio of true positive predictions to the total actual positives for that class."
175,What is the purpose of the term mean absolute error (MAE) in regression models?,"Mean Absolute Error (MAE) is a metric used in regression models to measure the average absolute difference between predicted and actual values. It provides a straightforward measure of prediction accuracy, where lower MAE values indicate better model performance in terms of minimizing the absolute errors across all data points."
176,Explain the concept of the term adversarial training in machine learning.,Adversarial training involves training a machine learning model on both regular data and adversarial examples deliberately designed to mislead the model. It aims to improve the model's robustness and resistance to adversarial attacks. Adversarial training is commonly used in applications where security and resilience against malicious inputs are crucial.
177,What is the role of the term word sense disambiguation in natural language processing?,"Word sense disambiguation is the process of determining the correct meaning of a word in a given context. It enhances natural language processing tasks by ensuring that algorithms understand the intended meaning of words in various contexts, reducing ambiguity and improving semantic understanding."
178,Define the terms true positive rate and false positive rate in binary classification.,"True Positive Rate (TPR), also known as sensitivity or recall, measures the proportion of actual positive instances correctly identified by a binary classification model. False Positive Rate (FPR) measures the proportion of actual negative instances incorrectly classified as positive. TPR and FPR are essential for assessing model performance, especially in medical diagnostics and security applications."
179,What is the purpose of the term k-fold cross-validation in machine learning?,"K-fold cross-validation is a technique used to assess the performance and generalization ability of a machine learning model. The dataset is divided into k subsets, and the model is trained and validated k times, each time using a different subset for validation and the remaining data for training. K-fold cross-validation provides a robust estimate of a model's performance across different data splits."
180,How does the concept of the term precision-recall tradeoff impact model performance in binary classification?,"The precision-recall tradeoff involves adjusting the classification model's threshold to balance precision and recall. Increasing one metric often comes at the expense of the other. The tradeoff is crucial for optimizing model performance based on specific application requirements, considering the varying costs of false positives and false negatives."
181,Explain the concept of the term batch normalization in deep neural networks.,"Batch normalization is a technique used in deep neural networks to normalize the input of each layer by adjusting and scaling the activations within mini-batches. It helps address issues like internal covariate shift, accelerates training convergence, and improves the overall stability and generalization of deep neural networks."
182,What is the role of the term hyperparameter in machine learning models?,"Hyperparameters are external configuration settings for machine learning models that are not learned from the data but set before the training process. Examples include learning rates, regularization strengths, and model architecture choices. Proper selection of hyperparameters is crucial for achieving optimal model performance and generalization on unseen data."
183,Define the terms false discovery rate (FDR) and false omission rate (FOR) in binary classification.,False Discovery Rate (FDR) measures the proportion of false positive predictions among all predicted positives in binary classification. False Omission Rate (FOR) measures the proportion of false negative predictions among all predicted negatives. Both metrics provide insights into different aspects of model performance and are used in applications where the cost of errors varies.
184,What is the purpose of the term bias-variance tradeoff in machine learning?,"The bias-variance tradeoff is a fundamental concept in machine learning that illustrates the balance between bias and variance in model performance. High bias leads to underfitting, while high variance leads to overfitting. Achieving an optimal tradeoff results in a model that generalizes well to new, unseen data."
185,Explain the concept of the term collaborative filtering in recommendation systems.,"Collaborative filtering is a recommendation system technique that relies on user-item interactions and user preferences. It identifies similarities between users or items based on their historical behavior and recommends items liked by users with similar preferences. Collaborative filtering can be user-based or item-based, and it is widely used in personalized recommendation systems."
186,Define the terms dropout and its significance in training deep neural networks.,Dropout is a regularization technique used during training of deep neural networks. It involves randomly deactivating a fraction of neurons in each layer during each training iteration. Dropout helps prevent overfitting by introducing noise and promoting the learning of more robust features. It is particularly effective in improving the generalization of deep neural networks.
187,What is the purpose of the term ROC curve in evaluating binary classification models?,"The Receiver Operating Characteristic (ROC) curve is a graphical representation of the trade-off between true positive rate (sensitivity) and false positive rate (1-specificity) at various thresholds. It provides a comprehensive assessment of a binary classification model's performance, allowing practitioners to choose an appropriate threshold based on the desired balance between sensitivity and specificity."
188,How does the concept of the term word frequency-inverse document frequency (TF-IDF) contribute to text representation in information retrieval?,"TF-IDF is a numerical statistic used in information retrieval to evaluate the importance of a word in a document relative to a collection of documents. It considers both the frequency of a term in a document and its rarity across the entire collection, providing a weighted representation of terms for document analysis."
189,Define the terms learning rate and its significance in training machine learning models.,"Learning rate is a hyperparameter that determines the size of the steps taken during optimization to reach the minimum of the loss function. An appropriate learning rate is crucial for efficient convergence and model training. A too high learning rate may lead to overshooting, while a too low learning rate may result in slow convergence or getting stuck in local minima."
190,What is the role of the term precision-recall-F1 score in evaluating classification models?,"Precision, recall, and F1 score are metrics used to evaluate the performance of classification models. F1 score is the harmonic mean of precision and recall, providing a balanced measure that considers both false positives and false negatives. It is particularly useful in situations where there is an imbalance between positive and negative instances in the dataset."
191,What is the purpose of the term autoencoder in unsupervised learning?,"An autoencoder is a neural network architecture used in unsupervised learning to learn efficient representations of input data. It consists of an encoder and a decoder, and the network is trained to reconstruct its input. Autoencoders find applications in dimensionality reduction, feature learning, and anomaly detection."
192,Explain the concept of the term imbalanced dataset and its impact on machine learning models.,"An imbalanced dataset is characterized by unequal distribution of instances across different classes. It can impact machine learning models, particularly in binary classification, as the model may become biased towards the majority class. Techniques like resampling, using different evaluation metrics, and employing specialized algorithms are common strategies to address imbalanced datasets."
193,What is the role of the term mean precision in evaluating ranking algorithms?,"Mean Precision is a metric used to evaluate the effectiveness of ranking algorithms in information retrieval. It calculates the average precision across multiple queries or instances, providing a comprehensive measure of the algorithm's ability to rank relevant items higher. Mean Precision is especially relevant in scenarios where ranking accuracy is crucial, such as search engines."
194,Define the terms overfitting and underfitting in machine learning models.,"Overfitting occurs when a machine learning model learns the training data too well, capturing noise and outliers, but fails to generalize to new, unseen data. Underfitting, on the other hand, happens when the model is too simple and cannot capture the underlying patterns in the data. Balancing between overfitting and underfitting is crucial for optimal model performance."
195,What is the purpose of the term word2vec in natural language processing?,"Word2Vec is a technique in natural language processing that represents words as vectors in a continuous vector space. It captures semantic relationships between words, allowing algorithms to understand context and similarity. Word2Vec finds applications in various NLP tasks, such as word similarity, document clustering, and sentiment analysis."
196,Explain the concept of the term t-SNE (t-Distributed Stochastic Neighbor Embedding) in dimensionality reduction.,t-SNE is a dimensionality reduction technique that maps high-dimensional data to a lower-dimensional space while preserving pairwise similarities. It is particularly effective in visualizing complex relationships and clusters in data. t-SNE is commonly used in exploratory data analysis and feature visualization in machine learning and data analysis.
197,Define the terms precision and recall in the context of information retrieval.,"In information retrieval, precision is the ratio of relevant documents retrieved to the total documents retrieved, measuring the accuracy of retrieved results. Recall, on the other hand, is the ratio of relevant documents retrieved to the total relevant documents in the collection, indicating the ability to retrieve all relevant documents."
198,What is the role of the term LDA (Latent Dirichlet Allocation) in topic modeling?,"Latent Dirichlet Allocation (LDA) is a probabilistic model used for topic modeling in natural language processing. It assumes that documents are mixtures of topics and that each topic is a mixture of words. LDA helps identify latent topics within a collection of documents, providing insights into the underlying themes and structure of the text data."
199,How does the concept of the term hyperparameter affect the training process of machine learning models?,"Hyperparameters are external configuration settings for machine learning models that are not learned from the data but set before the training process. Proper tuning of hyperparameters is essential for achieving optimal model performance. Hyperparameters include learning rates, regularization strengths, and architecture choices, and their values significantly impact the model's learning and generalization ability."
200,What is the purpose of the term A/B testing in evaluating the effectiveness of machine learning models?,"A/B testing is a technique used to compare two versions (A and B) of a system, such as a machine learning model, to determine which performs better. It involves randomly assigning users or instances to different versions and collecting data on their interactions. A/B testing provides valuable insights into the real-world performance and user impact of models."
201,Explain the concept of the term precision-recall curve in evaluating classification models.,"The precision-recall curve is a graphical representation of the trade-off between precision and recall at various classification thresholds. It is particularly useful for assessing model performance on imbalanced datasets, where precision and recall are critical. The area under the precision-recall curve (AUC-PR) provides a summarized metric for overall model evaluation."
202,Define the terms bag-of-words and its application in text classification.,"Bag-of-words is a text representation technique that disregards word order and focuses on the frequency of words in a document. It represents a document as an unordered set of words and their frequencies. Bag-of-words is commonly used in text classification tasks, where the presence and frequency of words are important features for analysis."
203,What is the role of the term bias in machine learning models?,"Bias in machine learning models refers to systematic errors or inaccuracies that arise from assumptions, simplifications, or limitations in the learning algorithm. Bias can lead to underestimating or overestimating certain patterns in the data, affecting the model's ability to generalize. Addressing bias is crucial for ensuring fair and accurate predictions across diverse datasets."
204,How does the concept of the term precision-recall-AUC impact model evaluation in binary classification?,"Precision-recall-AUC is a metric that considers the area under the precision-recall curve. It provides a comprehensive measure of a model's performance, especially in imbalanced datasets where precision and recall are crucial. A higher precision-recall-AUC indicates a better trade-off between precision and recall across different threshold values, offering insights into overall model effectiveness."
205,Define the terms K-means clustering and its application in unsupervised learning.,"K-means clustering is an unsupervised machine learning algorithm used for partitioning a dataset into K clusters. It assigns data points to clusters based on the similarity of features, with the goal of minimizing intra-cluster variability and maximizing inter-cluster differences. K-means clustering finds applications in data segmentation, image compression, and customer segmentation."
206,What is the purpose of the term dropout in convolutional neural networks (CNNs)?,Dropout in convolutional neural networks involves randomly deactivating a fraction of neurons during training. It helps prevent overfitting by introducing noise and promoting the learning of more robust features. Dropout is particularly beneficial in CNNs to address challenges like vanishing gradients and improve the generalization of the model for image recognition tasks.
207,Explain the concept of the term word embedding in natural language processing.,"Word embedding is a technique in natural language processing that represents words as dense vectors in a continuous vector space. It captures semantic relationships between words, allowing algorithms to understand context and meaning. Word embeddings enhance the representation of words, enabling improved performance in various NLP tasks, such as sentiment analysis and machine translation."
