id,question,answer
1,What is Data Science?,"Data Science is an interdisciplinary field that uses scientific methods, processes, algorithms, and systems to extract insights and knowledge from structured and unstructured data."
2,Explain the difference between supervised and unsupervised learning.,"Supervised learning involves training a model on a labeled dataset, while unsupervised learning deals with unlabeled data, aiming to find patterns and relationships without predefined outputs."
3,What is a decision tree in machine learning?,"A decision tree is a predictive model that maps features to outcomes. It consists of nodes representing decision points, branches as possible outcomes, and leaves as the final predictions."
4,What is the purpose of cross-validation in machine learning?,"Cross-validation is a technique used to assess the performance and generalization of a machine learning model by dividing the dataset into multiple subsets, training on some, and testing on others in a repeated manner."
5,Explain the concept of overfitting in machine learning.,"Overfitting occurs when a model learns the training data too well, capturing noise and irrelevant patterns, leading to poor performance on new, unseen data."
6,What is feature engineering?,"Feature engineering involves selecting, transforming, or creating input features to improve a model's performance, interpretability, and efficiency in representing the underlying data."
7,Define precision and recall in the context of classification.,Precision is the ratio of correctly predicted positive observations to the total predicted positives. Recall is the ratio of correctly predicted positive observations to the all observations in the actual class.
8,What is the purpose of regularization in machine learning?,"Regularization is used to prevent overfitting by adding a penalty term to the model's objective function, discouraging overly complex models that may fit the training data too closely."
9,Explain the bias-variance tradeoff.,"The bias-variance tradeoff is a key concept in machine learning, illustrating the balance between underfitting (high bias) and overfitting (high variance). Achieving a good tradeoff is crucial for model performance."
10,What is clustering in unsupervised learning?,"Clustering involves grouping similar data points together based on certain features, with the goal of discovering inherent structures or patterns within the data without predefined class labels."
11,What is the curse of dimensionality in machine learning?,"The curse of dimensionality refers to the challenges and increased complexity that arise when working with high-dimensional data, such as increased computational requirements and a sparsity of data."
12,What is a confusion matrix?,"A confusion matrix is a table used in classification to evaluate the performance of a model. It displays the true positive, true negative, false positive, and false negative values."
13,Explain the concept of bagging in ensemble learning.,"Bagging, or Bootstrap Aggregating, is an ensemble learning technique where multiple models are trained on different subsets of the dataset using bootstrapped samples, and their predictions are combined for improved accuracy."
14,What is the difference between precision and accuracy?,"Precision is the ratio of correctly predicted positive observations to the total predicted positives, while accuracy is the ratio of correctly predicted observations to the total observations."
15,What is natural language processing (NLP) in the context of data science?,"Natural Language Processing is a subfield of artificial intelligence that focuses on the interaction between computers and human languages, enabling machines to understand, interpret, and generate human-like text."
16,Define the terms underfitting and overfitting in machine learning.,"Underfitting occurs when a model is too simple to capture the underlying patterns in the data, while overfitting occurs when a model is too complex and fits the training data too closely, performing poorly on new data."
17,What is the role of a validation set in training machine learning models?,"A validation set is used to tune hyperparameters during the training process and to evaluate the model's performance on data it has not seen before, helping to prevent overfitting."
18,What is the purpose of gradient descent in machine learning?,Gradient descent is an optimization algorithm used to minimize the error or loss function during the training of machine learning models by adjusting the model's parameters in the direction of the steepest decrease in the error.
19,What is the difference between correlation and causation?,"Correlation indicates a statistical relationship between two variables, while causation implies that changes in one variable directly cause changes in another. Correlation does not imply causation."
20,What is the purpose of a dropout layer in neural networks?,"A dropout layer is used in neural networks to prevent overfitting by randomly setting a fraction of input units to zero during each update, forcing the network to learn more robust features."
21,Explain the bias-variance tradeoff in the context of model complexity.,The bias-variance tradeoff highlights the balance between the error introduced by approximating a real-world problem and the model's sensitivity to fluctuations in the training data. A more complex model may fit the training data well but might fail to generalize to new data.
22,What is a ROC curve used for in machine learning?,A Receiver Operating Characteristic (ROC) curve is used to evaluate the performance of a binary classification model by plotting the true positive rate against the false positive rate at various thresholds.
23,How does regularization help prevent overfitting in machine learning models?,"Regularization adds a penalty term to the model's objective function, discouraging the use of complex features and preventing overfitting by imposing constraints on the model's parameters."
24,What are hyperparameters in machine learning models?,"Hyperparameters are configuration settings external to the model that influence its performance but are not learned from the data. Examples include learning rate, regularization strength, and the number of hidden layers in a neural network."
25,Define feature scaling and its importance in machine learning.,"Feature scaling is the process of standardizing or normalizing the range of independent variables or features in the dataset. It is crucial to ensure that no single feature dominates the learning process, especially in algorithms sensitive to feature scales, like gradient-based methods."
26,What is cross-entropy loss in the context of classification models?,"Cross-entropy loss, or log loss, measures the performance of a classification model whose output is a probability value between 0 and 1. It penalizes the model more when it confidently predicts an incorrect class."
27,What is the purpose of a kernel in support vector machines (SVM)?,"In SVM, a kernel is a function that transforms the input data into a higher-dimensional space, making it easier to find a hyperplane that separates different classes."
28,Explain the concept of ensemble learning.,Ensemble learning involves combining multiple models to create a stronger and more robust model. Methods like bagging and boosting are common techniques used in ensemble learning.
29,What is the difference between batch gradient descent and stochastic gradient descent?,"Batch gradient descent updates the model's parameters using the entire training dataset in each iteration, while stochastic gradient descent updates the parameters using only one randomly selected data point at a time, making it computationally more efficient."
30,How does transfer learning benefit machine learning models?,"Transfer learning allows a model trained on one task to be adapted or fine-tuned for another related task, leveraging knowledge gained from the first task and often resulting in faster convergence and improved performance."
31,What is the K-nearest neighbors (KNN) algorithm?,K-nearest neighbors is a supervised learning algorithm used for classification and regression. It makes predictions based on the majority class or average of the K-nearest data points in the feature space.
32,Explain the concept of word embeddings in natural language processing.,"Word embeddings are dense vector representations of words in a continuous vector space. They capture semantic relationships between words, allowing algorithms to understand the context and meaning of words in a more nuanced way than traditional one-hot encoding."
33,"What is dimensionality reduction, and why is it used in machine learning?","Dimensionality reduction is the process of reducing the number of input features in a dataset. It is used to mitigate the curse of dimensionality, improve computational efficiency, and potentially enhance model generalization by focusing on the most informative features."
34,What is a Markov Chain Monte Carlo (MCMC) method?,MCMC is a statistical technique used for sampling from a probability distribution. It is particularly useful for Bayesian inference and complex models where direct sampling is challenging.
35,What is the purpose of a learning rate in gradient descent optimization?,The learning rate determines the step size at each iteration during the gradient descent optimization process. It influences how quickly or slowly the model parameters are updated and can affect convergence and model performance.
36,Define the terms precision and recall in the context of binary classification.,"Precision is the ratio of correctly predicted positive observations to the total predicted positives, while recall is the ratio of correctly predicted positive observations to all observations in the actual positive class."
37,What is the role of an activation function in a neural network?,"An activation function introduces non-linearity into a neural network, allowing it to learn complex patterns. Common activation functions include ReLU (Rectified Linear Unit), sigmoid, and tanh."
38,Explain the concept of batch normalization in deep learning.,Batch normalization is a technique used to improve the training of deep neural networks by normalizing the input of each layer. It helps mitigate issues like vanishing or exploding gradients and accelerates convergence.
39,What is transfer learning in the context of neural networks?,Transfer learning involves using a pre-trained neural network on a specific task as a starting point for a related task. It helps leverage knowledge gained from one task to improve performance on another task with less data.
40,What are hyperparameter tuning techniques in machine learning?,"Hyperparameter tuning involves optimizing the settings external to the model, such as learning rates or regularization parameters, to enhance a model's performance. Techniques include grid search, random search, and Bayesian optimization."
41,What is the purpose of a confusion matrix in classification models?,"A confusion matrix is used to evaluate the performance of a classification model by presenting a summary of true positive, true negative, false positive, and false negative predictions. It provides insights into the model's accuracy, precision, recall, and F1 score."
42,Explain the concept of feature importance in machine learning models.,Feature importance quantifies the contribution of each input feature to the model's predictive performance. It helps identify the most influential features and aids in feature selection and interpretation of model results.
43,What is the purpose of a validation set in machine learning?,"A validation set is used to assess a model's performance during training, helping to detect overfitting and select optimal hyperparameters. It provides an independent dataset that was not used for training but helps fine-tune the model."
44,What is the difference between bagging and boosting in ensemble learning?,"Bagging (Bootstrap Aggregating) and boosting are ensemble learning techniques. Bagging builds multiple models independently and combines their predictions, while boosting trains models sequentially, giving more weight to misclassified instances to improve overall accuracy."
45,What is the role of the loss function in machine learning?,The loss function quantifies the difference between the predicted values and the actual values in a model. Minimizing the loss function during training is the primary goal to improve the model's predictive accuracy.
46,Define the terms underfitting and overfitting in machine learning.,"Underfitting occurs when a model is too simple to capture the underlying patterns in the data, leading to poor performance. Overfitting occurs when a model fits the training data too closely, capturing noise and performing poorly on new, unseen data."
47,What is the role of dropout in neural networks?,"Dropout is a regularization technique used in neural networks to prevent overfitting. It randomly drops a fraction of neurons during training, forcing the network to learn more robust features and improving generalization to unseen data."
48,How does the Naive Bayes algorithm work in machine learning?,"Naive Bayes is a probabilistic classification algorithm based on Bayes' theorem. It assumes independence between features, simplifying computations. It's often used in text classification and spam filtering."
49,What is the purpose of the Adam optimizer in neural network training?,"The Adam optimizer is an optimization algorithm used in training neural networks. It combines the advantages of two other popular algorithms, RMSprop and momentum, to achieve faster convergence and better handling of sparse gradients."
50,Explain the concept of precision-recall tradeoff.,"The precision-recall tradeoff is a balance between precision and recall in classification models. As one metric improves, the other may decline. It is essential to find an optimal tradeoff based on the specific requirements of the application."
51,What is the concept of a kernel trick in support vector machines?,A kernel trick involves transforming input data into a higher-dimensional space without explicitly computing the transformation. It allows support vector machines to handle non-linear relationships between features.
52,Explain the concept of the bias term in linear regression models.,"The bias term, or intercept, in a linear regression model represents the predicted output when all input features are zero. It ensures that the model can make accurate predictions even when the features do not."
53,"What is a hash function, and how is it used in machine learning?","A hash function maps data of arbitrary size to a fixed-size value, typically a hash code. In machine learning, hash functions are used in techniques like feature hashing to reduce the dimensionality of high-cardinality categorical features."
54,How does the concept of batch size affect training in deep learning?,"Batch size represents the number of data points processed in each iteration during the training of a neural network. It impacts the computational efficiency, memory requirements, and the convergence behavior of the training process."
55,Define the terms precision and recall in the context of multi-class classification.,"In multi-class classification, precision is the ratio of correctly predicted instances of a specific class to the total predicted instances of that class, while recall is the ratio of correctly predicted instances of a class to the total actual instances of that class."
56,What is the purpose of a one-hot encoding in machine learning?,"One-hot encoding is a technique used to represent categorical variables as binary vectors. Each category is represented by a unique binary value, making it suitable for algorithms that require numerical input."
57,Explain the concept of feature extraction in image processing.,"Feature extraction involves transforming raw image data into a more compact representation by extracting relevant features such as edges, corners, or textures. It simplifies the input for machine learning algorithms and enhances their ability to detect patterns."
58,What is the purpose of the term TF-IDF in natural language processing?,"TF-IDF, or Term Frequency-Inverse Document Frequency, is a numerical statistic used to evaluate the importance of a word in a document relative to a collection of documents. It is commonly used in information retrieval and text mining."
59,How does dropout contribute to regularization in neural networks?,"Dropout is a regularization technique that randomly sets a fraction of neurons to zero during training. It prevents co-adaptation of neurons and encourages the network to learn more robust features, reducing overfitting."
60,What is the role of the sigmoid activation function in neural networks?,"The sigmoid activation function is commonly used in the output layer of binary classification models. It squashes the output values between 0 and 1, representing probabilities and aiding in decision-making."
61,Explain the concept of data augmentation in image classification.,"Data augmentation involves creating new training samples by applying various transformations to the existing data, such as rotation, flipping, or scaling. It helps improve the model's robustness and generalization to unseen data."
62,What is the role of the F1 score in evaluating classification models?,"The F1 score is the harmonic mean of precision and recall. It provides a balanced measure that considers both false positives and false negatives, making it useful for evaluating the overall performance of a classification model."
63,Define the terms L1 and L2 regularization in machine learning.,"L1 regularization adds the absolute values of the coefficients to the loss function, promoting sparsity. L2 regularization adds the squared values of the coefficients, penalizing large weights and preventing overfitting."
64,What is the purpose of a word2vec model in natural language processing?,"Word2Vec is a technique to represent words as dense vectors in a continuous vector space. It captures semantic relationships between words and is used in various NLP tasks, such as text classification and sentiment analysis."
65,How does the concept of entropy relate to decision tree models?,"Entropy is a measure of impurity or disorder in a set of data. In decision tree models, entropy is used to determine the best split by minimizing the impurity in each resulting subset during the tree-building process."
66,What is the purpose of a confusion matrix in machine learning?,"A confusion matrix is a table that summarizes the performance of a classification model by presenting the counts of true positive, true negative, false positive, and false negative predictions. It helps evaluate the model's accuracy, precision, recall, and F1 score."
67,Explain the concept of reinforcement learning in machine learning.,"Reinforcement learning is a type of machine learning where an agent learns to make decisions by interacting with an environment. The agent receives feedback in the form of rewards or punishments, guiding it to optimize its behavior over time."
68,What is the role of the learning rate in training neural networks?,The learning rate is a hyperparameter that determines the size of the steps taken during the optimization process of neural networks. It influences the convergence speed and stability of the training process.
69,Define the terms precision and recall in the context of information retrieval.,"In information retrieval, precision is the ratio of relevant documents retrieved to the total documents retrieved, while recall is the ratio of relevant documents retrieved to the total relevant documents in the entire collection."
70,What is the purpose of a support vector in a support vector machine (SVM)?,A support vector is a data point that lies closest to the decision boundary in a support vector machine. These points are crucial in determining the optimal hyperplane that separates different classes in the feature space.
71,What is the purpose of a confusion matrix in multi-class classification?,"In multi-class classification, a confusion matrix provides a detailed summary of the model's performance, showing the counts of true positive, true negative, false positive, and false negative predictions for each class. It aids in evaluating precision, recall, and overall accuracy."
72,Explain the concept of imbalanced datasets in machine learning.,"Imbalanced datasets occur when the number of instances in different classes is significantly unequal. It can pose challenges for machine learning models, as they may become biased toward the majority class. Techniques like resampling or using specialized algorithms address this issue."
73,What is the purpose of the term dropout in recurrent neural networks (RNNs)?,Dropout in recurrent neural networks involves randomly setting a fraction of the hidden units to zero during training. It helps prevent overfitting by introducing variability and improving the generalization capability of the model to sequential data.
74,Define the terms precision and recall in the context of clustering evaluation.,"In clustering evaluation, precision measures the accuracy of the identified clusters, representing the ratio of correctly assigned instances to the total instances in a cluster. Recall measures the completeness of the clusters, indicating the ratio of correctly assigned instances to the total instances of a true cluster."
75,What is the role of the term activation function in convolutional neural networks (CNNs)?,"Activation functions in CNNs introduce non-linearity to the model, allowing it to learn complex patterns and relationships in image data. Common activation functions include ReLU (Rectified Linear Unit) and sigmoid, applied to the output of convolutional layers."
76,Explain the concept of transfer learning in the context of image classification.,"In image classification, transfer learning involves using a pre-trained neural network on a large dataset as a starting point for a new, possibly smaller dataset. It accelerates model training and often leads to better performance on the target task."
77,What is the purpose of the term feature scaling in machine learning?,"Feature scaling standardizes or normalizes the range of input features, ensuring that no single feature dominates the learning process. It is crucial for algorithms sensitive to feature scales, such as gradient-based optimization methods in machine learning."
78,Define the terms precision and recall in the context of anomaly detection.,"In anomaly detection, precision measures the accuracy of correctly identified anomalies, representing the ratio of true positive anomalies to the total predicted anomalies. Recall measures the ability to detect anomalies, indicating the ratio of true positive anomalies to the total true anomalies in the dataset."
79,How does the concept of word frequency play a role in text mining?,"Word frequency is the number of times a word appears in a document or a corpus. In text mining, analyzing word frequency helps identify important terms, create features for machine learning models, and understand the overall structure of the text."
80,What is the purpose of a ROC-AUC curve in binary classification models?,The Receiver Operating Characteristic-Area Under the Curve (ROC-AUC) curve is used to evaluate the performance of a binary classification model by measuring the trade-off between true positive rate and false positive rate across different threshold values. A higher AUC indicates better model performance.
81,Explain the concept of kernel density estimation in statistical modeling.,"Kernel density estimation is a non-parametric method to estimate the probability density function of a random variable. It involves placing a kernel (smoothed function) at each data point and summing them to create a smooth density estimate, providing insights into the underlying distribution of the data."
82,What is the role of the term bagging in ensemble learning?,"Bagging (Bootstrap Aggregating) in ensemble learning involves training multiple models independently on different subsets of the dataset created through bootstrapping. The models' predictions are combined to reduce variance, improve stability, and enhance overall predictive performance."
83,Define the terms recall and precision in the context of information retrieval.,"In information retrieval, recall measures the ability of a system to retrieve all relevant documents from a collection, indicating the ratio of relevant documents retrieved to the total number of relevant documents. Precision measures the accuracy of the retrieved documents, representing the ratio of relevant documents retrieved to the total documents retrieved."
84,What is the purpose of the term word embedding in natural language processing?,"Word embeddings are dense vector representations of words in a continuous vector space. In natural language processing, they capture semantic relationships between words, enabling algorithms to understand context and meaning, and are used in various NLP tasks such as text classification and sentiment analysis."
85,Explain the concept of hyperparameter tuning in machine learning.,"Hyperparameter tuning involves optimizing the settings external to the machine learning model, such as learning rates or regularization parameters, to enhance the model's performance. Techniques include grid search, random search, and Bayesian optimization."
86,What is the purpose of the term chi-square test in feature selection?,The chi-square test in feature selection is used to evaluate the independence between a categorical feature and the target variable in a classification problem. Features with high chi-square statistics are considered more relevant for predicting the target variable.
