id,question,answer
263,What is the purpose of the term word sense disambiguation in natural language processing?,Word sense disambiguation is the process of determining the correct meaning of a word in a given context. It addresses the ambiguity of words with multiple meanings by selecting the most appropriate sense based on the context. Word sense disambiguation enhances the accuracy of natural language processing tasks by ensuring algorithms interpret words correctly in diverse contexts.
264,Explain the concept of the term reinforcement learning and its application in machine learning.,"Reinforcement learning is a type of machine learning where an agent learns to make decisions by interacting with an environment. The agent receives feedback in the form of rewards or penalties based on its actions. Reinforcement learning is applied in tasks such as game playing, robotic control, and optimization problems where an agent learns through trial and error."
265,Define the terms precision-recall curve and its significance in evaluating binary classification models.,"The precision-recall curve is a graphical representation of the trade-off between precision and recall at various classification thresholds. It is particularly useful for assessing model performance on imbalanced datasets, where precision and recall are critical. The area under the precision-recall curve (AUC-PR) provides a summarized metric for overall model evaluation."
266,What is the role of the term k-nearest neighbors (KNN) algorithm in machine learning?,"The k-nearest neighbors (KNN) algorithm is a non-parametric and lazy learning method used for classification and regression tasks. It classifies new data points based on the majority class of their k nearest neighbors in the feature space. KNN is simple and effective, especially for small datasets and tasks where local patterns are important."
267,Explain the concept of the term ensemble learning in machine learning.,"Ensemble learning involves combining predictions from multiple models to improve overall performance. Techniques like bagging and boosting create diverse models, reducing overfitting and enhancing generalization. Ensemble learning is effective in improving accuracy, robustness, and stability, making it a valuable approach across various machine learning tasks, including classification and regression."
268,Define the terms false discovery rate (FDR) and false omission rate (FOR) in binary classification.,False Discovery Rate (FDR) measures the proportion of false positive predictions among all predicted positives in binary classification. False Omission Rate (FOR) measures the proportion of false negative predictions among all predicted negatives. Both FDR and FOR provide insights into different aspects of model performance and are relevant in applications where the cost of errors varies.
269,What is the purpose of the term dropout in neural networks?,"Dropout in neural networks involves randomly deactivating a fraction of neurons during training. It helps prevent overfitting by introducing noise and promoting the learning of more robust features. Dropout is particularly effective in deep neural networks, where overfitting is a common challenge, and it contributes to improved generalization on unseen data."
270,Explain the concept of the term dimensionality reduction and its application in machine learning.,Dimensionality reduction aims to reduce the number of input features while preserving essential information. It is applied to high-dimensional datasets to address issues like the curse of dimensionality and improve computational efficiency. Techniques like Principal Component Analysis (PCA) and t-Distributed Stochastic Neighbor Embedding (t-SNE) are commonly used for dimensionality reduction.
271,Define the terms bias-variance tradeoff and its significance in machine learning models.,"The bias-variance tradeoff is a fundamental concept in machine learning that illustrates the balance between bias and variance in model performance. High bias leads to underfitting, while high variance leads to overfitting. Achieving an optimal tradeoff results in a model that generalizes well to new, unseen data by capturing underlying patterns without being overly influenced by noise."
272,What is the role of the term recurrent neural network (RNN) in sequential data processing?,"A recurrent neural network (RNN) is designed for processing sequential data by maintaining a hidden state that captures information about previous inputs. RNNs are effective in tasks where context and order matter, such as natural language processing, speech recognition, and time series analysis. However, they face challenges like vanishing gradients in long sequences."
273,Explain the concept of the term Naive Bayes classifier in machine learning.,"Naive Bayes is a probabilistic classification algorithm based on Bayes' theorem. It assumes that features are conditionally independent given the class label, which simplifies the modeling process. Naive Bayes is particularly effective for text classification tasks, spam filtering, and other applications where the independence assumption holds reasonably well."
274,Define the terms overfitting and underfitting in machine learning models.,"Overfitting occurs when a model learns the training data too well, capturing noise and outliers, but performs poorly on new, unseen data. Underfitting happens when a model is too simple and cannot capture the underlying patterns in the training data. Balancing between overfitting and underfitting is crucial for developing models that generalize well to diverse datasets."
275,What is the purpose of the term data augmentation in image classification?,"Data augmentation in image classification involves creating new training samples by applying various transformations to existing images, such as rotations, flips, and zooms. It helps increase the diversity of the training dataset, improving the model's ability to generalize to new, unseen data. Data augmentation is a common technique to address limited labeled data in image classification tasks."
276,Explain the concept of the term word embeddings in natural language processing.,"Word embeddings are dense vector representations of words in a continuous vector space. They capture semantic relationships between words, enabling machine learning models to understand context and meaning. Word embeddings are widely used in natural language processing tasks, such as sentiment analysis, machine translation, and named entity recognition."
277,Define the terms precision and recall in the context of multi-class classification.,"In multi-class classification, precision measures the accuracy of positive predictions for a specific class, representing the ratio of true positive predictions to the total predicted positives for that class. Recall measures the ability to capture all instances of a specific class, indicating the ratio of true positive predictions to the total actual positives for that class."
278,"What is the role of the term imbalanced datasets in machine learning, and how can it impact model performance?","Imbalanced datasets occur when the distribution of classes in the training data is uneven, with one or more classes having significantly fewer samples than others. This imbalance can lead to biased models that favor the majority class. Addressing imbalanced datasets is crucial to ensure fair and accurate predictions, often involving techniques like oversampling, undersampling, or using appropriate evaluation metrics."
279,Explain the concept of the term mean absolute error (MAE) in regression models.,Mean Absolute Error (MAE) is a metric used in regression models to measure the average absolute difference between predicted and actual values. It provides a straightforward assessment of prediction accuracy without emphasizing the impact of large errors. MAE is commonly used as a loss function during the training of regression models.
280,Define the terms bagging and boosting in ensemble learning and their respective advantages.,"Bagging (Bootstrap Aggregating) and boosting are ensemble learning techniques. Bagging involves training multiple models independently on different subsets of the training data and aggregating their predictions. Boosting focuses on sequentially training models, giving more weight to misclassified instances. Both techniques reduce overfitting and variance, with bagging offering parallel training and boosting emphasizing corrective learning."
281,What is the purpose of the term mean squared error (MSE) in regression models?,"Mean Squared Error (MSE) is a metric used in regression models to measure the average squared difference between predicted and actual values. It penalizes large errors more heavily, providing a comprehensive measure of prediction accuracy. MSE is commonly used as a loss function during the training of regression models."
282,Explain the concept of the term hierarchical clustering in machine learning.,"Hierarchical clustering is a method of grouping similar data points into clusters based on their pairwise distances. It creates a tree-like structure (dendrogram) that illustrates the hierarchical relationships between clusters. Hierarchical clustering can be agglomerative, starting with individual data points as clusters, or divisive, beginning with a single cluster and dividing it into subclusters."
283,Define the terms precision and recall in the context of information retrieval.,"In information retrieval, precision measures the accuracy of positive predictions, representing the ratio of relevant documents retrieved to the total retrieved documents. Recall measures the ability to capture all relevant documents, indicating the ratio of relevant documents retrieved to the total actual relevant documents. Precision and recall are crucial for evaluating the effectiveness of retrieval systems."
284,What is the role of the term dropout in neural networks?,"Dropout in neural networks involves randomly deactivating a fraction of neurons during training. It helps prevent overfitting by introducing noise and promoting the learning of more robust features. Dropout is particularly effective in deep neural networks, where overfitting is a common challenge, and it contributes to improved generalization on unseen data."
285,Explain the concept of the term support vector machine (SVM) in machine learning.,"Support Vector Machine (SVM) is a supervised learning algorithm used for classification and regression tasks. It works by finding the hyperplane that best separates data points into different classes. SVM is effective in high-dimensional spaces, and it can use kernel functions to handle non-linear decision boundaries. It is widely used in various applications, including image classification and text classification."
286,Define the terms batch normalization and its significance in training deep neural networks.,"Batch normalization is a technique in deep learning that normalizes the input of each layer to have zero mean and unit variance. It helps mitigate issues like internal covariate shift during training, making deep neural networks more stable and converge faster. Batch normalization is applied to mini-batches of data, and it contributes to improved generalization and training efficiency."
287,What is the purpose of the term hyperparameter tuning in machine learning?,"Hyperparameter tuning involves systematically searching for the best hyperparameter values to optimize a machine learning model's performance. It is essential for finding the right balance between model complexity and generalization. Techniques like grid search and random search are commonly used for hyperparameter tuning, contributing to enhanced model effectiveness in various tasks."
288,Explain the concept of the term precision-recall curve and its significance in evaluating classification models.,"The precision-recall curve is a graphical representation of the trade-off between precision and recall at various classification thresholds. It is particularly useful for assessing model performance on imbalanced datasets, where precision and recall are critical. The area under the precision-recall curve (AUC-PR) provides a summarized metric for overall model evaluation."
289,Define the terms natural language processing (NLP) and its applications.,"Natural Language Processing (NLP) is a subfield of artificial intelligence focused on enabling computers to understand, interpret, and generate human language. NLP applications include machine translation, sentiment analysis, chatbots, speech recognition, and text summarization. NLP techniques involve linguistic analysis, statistical modeling, and machine learning to extract meaningful information from textual data."
290,What is the role of the term word embeddings in natural language processing?,"Word embeddings are dense vector representations of words in a continuous vector space. They capture semantic relationships between words, enabling machine learning models to understand context and meaning. Word embeddings are widely used in natural language processing tasks, such as sentiment analysis, machine translation, and named entity recognition."
291,Explain the concept of the term decision tree in machine learning.,"A decision tree is a supervised machine learning algorithm used for classification and regression tasks. It represents a tree-like structure where each internal node represents a decision based on a feature, each branch represents an outcome of the decision, and each leaf node represents the final prediction. Decision trees are interpretable and effective in capturing complex relationships in data."
292,Define the terms precision and recall in the context of multi-label classification.,"In multi-label classification, precision measures the accuracy of positive predictions for a specific label, representing the ratio of true positive predictions to the total predicted positives for that label. Recall measures the ability to capture all instances of a specific label, indicating the ratio of true positive predictions to the total actual positives for that label."
293,What is the purpose of the term word sense disambiguation in natural language processing?,Word sense disambiguation is the process of determining the correct meaning of a word in a given context. It addresses the ambiguity of words with multiple meanings by selecting the most appropriate sense based on the context. Word sense disambiguation enhances the accuracy of natural language processing tasks by ensuring algorithms interpret words correctly in diverse contexts.
294,Explain the concept of the term ensemble learning in machine learning.,"Ensemble learning involves combining predictions from multiple models to improve overall performance. Techniques like bagging and boosting create diverse models, reducing overfitting and enhancing generalization. Ensemble learning is effective in improving accuracy, robustness, and stability, making it a valuable approach across various machine learning tasks, including classification and regression."
295,Define the terms false discovery rate (FDR) and false omission rate (FOR) in binary classification.,False Discovery Rate (FDR) measures the proportion of false positive predictions among all predicted positives in binary classification. False Omission Rate (FOR) measures the proportion of false negative predictions among all predicted negatives. Both FDR and FOR provide insights into different aspects of model performance and are relevant in applications where the cost of errors varies.
296,What is the role of the term transfer learning in computer vision?,"Transfer learning in computer vision involves leveraging knowledge gained from pre-trained models on one task to improve performance on a related task. It accelerates training and enhances model performance, especially when labeled data for the target task is limited. Transfer learning is widely used in image classification, object detection, and other computer vision applications."
297,Explain the concept of the term t-Distributed Stochastic Neighbor Embedding (t-SNE) in dimensionality reduction.,"t-Distributed Stochastic Neighbor Embedding (t-SNE) is a dimensionality reduction technique used for visualizing high-dimensional data in a lower-dimensional space. It aims to preserve the local structure of the data, making it effective for revealing clusters and patterns. t-SNE is commonly used in exploratory data analysis and visualization tasks to gain insights into the relationships within complex datasets."
298,Define the terms precision and recall in the context of anomaly detection.,"In anomaly detection, precision measures the accuracy of positive predictions for identifying anomalies, representing the ratio of true positive predictions to the total predicted anomalies. Recall measures the ability to capture all instances of anomalies, indicating the ratio of true positive predictions to the total actual anomalies. Precision and recall are crucial for assessing the effectiveness of anomaly detection models."
299,What is the purpose of the term random forest in ensemble learning?,Random Forest is an ensemble learning algorithm that builds multiple decision trees during training and merges their predictions to improve accuracy and generalization. It introduces randomness by considering a random subset of features for each split in the decision trees. Random Forest is effective in reducing overfitting and is widely used in classification and regression tasks.
300,Explain the concept of the term L1 regularization in machine learning models.,"L1 regularization adds the absolute values of the coefficients to the loss function during model training. It penalizes large coefficients, encouraging sparsity in the model. L1 regularization is effective in feature selection, as it tends to drive some coefficients to exactly zero. It is a technique to prevent overfitting and enhance the interpretability of machine learning models."
301,Define the terms cosine similarity and its application in measuring similarity between vectors.,"Cosine similarity is a metric used to measure the cosine of the angle between two non-zero vectors. It quantifies the similarity between vectors irrespective of their magnitudes and is commonly used in information retrieval, text mining, and recommendation systems. Cosine similarity ranges from -1 (opposite directions) to 1 (same direction), with 0 indicating orthogonality."
302,What is the role of the term gradient descent in training machine learning models?,"Gradient descent is an optimization algorithm used to minimize the loss function and find the optimal parameters during the training of machine learning models. It iteratively adjusts the model parameters in the direction of the steepest decrease in the loss function. Gradient descent is fundamental to training neural networks and other machine learning models, contributing to convergence and improved performance."
303,Explain the concept of the term hyperparameter tuning in optimizing machine learning models.,"Hyperparameter tuning involves adjusting the external configuration settings (hyperparameters) of machine learning models to achieve optimal performance. Common hyperparameters include learning rates, regularization strengths, and model architectures. Tuning these parameters is crucial for improving model convergence, generalization, and overall effectiveness in various machine learning tasks."
304,Define the terms bagging and its significance in ensemble learning.,"Bagging (Bootstrap Aggregating) is an ensemble learning technique that involves training multiple models independently on different subsets of the training data and aggregating their predictions. It helps reduce overfitting and variance, leading to improved generalization and robustness. Bagging is applied in various algorithms, with Random Forest being a notable example of a bagging-based ensemble method."
305,What is the purpose of the term activation function in neural networks?,"Activation functions in neural networks introduce non-linearity, enabling the model to learn complex patterns and relationships in the data. Common activation functions include sigmoid, tanh, and rectified linear unit (ReLU). Activation functions allow neural networks to approximate and represent non-linear mappings, enhancing the model's capacity to learn intricate features."
306,Explain the concept of the term chi-squared test and its application in feature selection.,"The chi-squared test is a statistical test used to assess the independence between categorical variables. In feature selection, it helps identify features that are most relevant to the target variable by measuring the association between each feature and the target. Features with high chi-squared values are considered more informative and are often selected for model training."
307,Define the terms precision at k (P@k) and its significance in recommendation systems.,"Precision at k (P@k) is a metric used in recommendation systems to evaluate the accuracy of top-k recommendations. It measures the proportion of relevant items among the top k recommended items. P@k is crucial in assessing the system's effectiveness, especially when users are interested in a specific number of top-ranked recommendations rather than the entire list."
308,What is the role of the term long-term memory (LTM) in human cognition?,"Long-term memory (LTM) is a component of human memory responsible for the storage of information over extended periods, ranging from hours to a lifetime. It encompasses declarative memory (facts and events) and procedural memory (skills and habits). LTM is critical for learning, knowledge retention, and various cognitive functions, playing a key role in shaping our understanding of the world."
309,Explain the concept of the term natural language understanding (NLU) in artificial intelligence.,"Natural Language Understanding (NLU) in artificial intelligence involves the ability of machines to comprehend and interpret human language. It goes beyond simple language processing and aims to extract meaning, context, and intent from text or speech. NLU is essential for developing advanced chatbots, virtual assistants, and other AI applications that require a deep understanding of human communication."
310,Define the terms precision-recall curve and its significance in evaluating binary classification models.,"The precision-recall curve is a graphical representation of the trade-off between precision and recall at various classification thresholds. It is particularly useful for assessing model performance on imbalanced datasets, where precision and recall are critical. The area under the precision-recall curve (AUC-PR) provides a summarized metric for overall model evaluation."
311,What is the purpose of the term regularization in machine learning models?,"Regularization in machine learning aims to prevent overfitting by adding a penalty term to the loss function during model training. It discourages the model from becoming too complex and relying too much on specific features in the training data. Common regularization techniques include L1 regularization, L2 regularization, and dropout, each addressing overfitting in different ways."
312,Explain the concept of the term word2vec in natural language processing.,"Word2Vec is a technique in natural language processing for representing words as dense vectors in a continuous vector space. It captures semantic relationships between words by learning vector representations that place similar words closer together. Word2Vec models, such as Skip-gram and Continuous Bag of Words (CBOW), are widely used for tasks like word similarity, language modeling, and document clustering."
313,Define the terms receiver operating characteristic (ROC) curve and its significance in evaluating classification models.,"The receiver operating characteristic (ROC) curve is a graphical representation of the trade-off between true positive rate (sensitivity) and false positive rate (1-specificity) at various classification thresholds. It is valuable for assessing the discriminatory power of classification models, especially in binary or multiclass scenarios. A higher area under the ROC curve (AUC-ROC) indicates better overall model performance."
314,What is the role of the term transfer learning in computer vision?,"Transfer learning in computer vision involves leveraging knowledge gained from pre-trained models on one task to improve performance on a related task. It accelerates training and enhances model performance, especially when labeled data for the target task is limited. Transfer learning is widely used in image classification, object detection, and other computer vision applications."
315,Explain the concept of the term autoencoder in unsupervised learning.,"An autoencoder is an unsupervised learning neural network architecture that learns to encode input data into a compact representation and then decode it back to the original input. It consists of an encoder network and a decoder network. Autoencoders are used for tasks like data compression, feature learning, and anomaly detection, where the model learns to reconstruct meaningful features from the input data."
316,Define the terms precision and recall in the context of clustering evaluation.,"In clustering evaluation, precision measures the accuracy of positive predictions for a specific cluster, representing the ratio of true positive instances to the total predicted instances for that cluster. Recall measures the ability to capture all instances of a specific cluster, indicating the ratio of true positive instances to the total actual instances for that cluster. Both precision and recall are crucial for assessing the effectiveness of clustering algorithms."
